{
  "artifact_class": "fixture_expected",
  "bound": false,
  "case_id": "seed-b2-session12-g3",
  "expected_final_message": "\u2705 test(commit-quality): pin residual Session-12 validation rows\n\nRefs: #204\nSemVer-Impact: NONE\nChange-Types: test\nChangelog-Groups: Tests\n",
  "expected_gold_codes": [
    "GOLD_WRONG_TYPE_ENVELOPE",
    "GOLD_PATH_CLASS_MISS"
  ],
  "failure_ids": [
    "F76",
    "F78",
    "F79",
    "F80"
  ],
  "final_message": "\ud83e\uddba fix(tests): complete residual close-out validation\n\nRefs: #204\nSemVer-Impact: PATCH\nChange-Types: fix\nChangelog-Groups: Fixed\n",
  "final_message_sha256": "02870f97f78fe8607269e426b5a1d4e3786a6a09fe27f90db057aa8e0f51ffc9",
  "generation_task_input": {
    "diff_summary": "tests/** residual validation pins only",
    "path_class_gate": "",
    "ranked_intent_id": "validation_update"
  },
  "instance_kind": "B",
  "meta": {
    "case_archive_id": "204-S12-G3",
    "corpus_source": "204_archive",
    "links": [
      "https://github.com/Thomo1318/gitCommitGenerator/issues/204",
      "https://github.com/Thomo1318/gitCommitGenerator/issues/223"
    ],
    "notes": "Session-12 G3 Regime B tests-as-fix false-green class.",
    "producer": "fixture_encoder_s1",
    "quality_case": "docs/quality/cases/204/session-12-g3.md",
    "seed_id": "SEED-B2",
    "series": "204-S12",
    "session_tags": [
      "session-12-seed"
    ],
    "suite_id": "204-archive",
    "tags": [
      "session-12-seed",
      "regime-b",
      "204-archive",
      "seed-b2",
      "204-S12-G3"
    ]
  },
  "metric_catalog": "metric_catalog_v0@430a62c1d7971e1145cfffd41e608a5f6bd39d284a3d050f991b8537f817eb75",
  "path_class_gate": "",
  "prevention_ids": [
    "P-S12-4",
    "P-S12-6",
    "P-S12-8",
    "P-S12-9"
  ],
  "provenance_label": "Opik-unbound",
  "redaction_profile": "default_scrub",
  "regime": "B",
  "schema_pack": "schema_pack_v0@cf17beafdc0f50db9db7dce81fc02f38c4b1b3c6cd8d9364f083148c4ea2d7fe",
  "schema_version": "ape_bundle_v1",
  "unbound_reason": "historical_204_archive_seed_not_acceptpath_bound"
}
